input_id,link,title,category,address,open_hours,popular_times,website,phone,plus_code,review_count,review_rating,reviews_per_rating,latitude,longitude,cid,status,descriptions,reviews_link,thumbnail,timezone,price_range,data_id,images,reservations,order_online,menu,owner,complete_address,about,user_reviews,user_reviews_extended,emails
aa99fea3-3573-4aa6-a383-e5337b7f6609,https://www.google.com/maps/place/CDP+Arquitectos/data=!4m7!3m6!1s0xd4228f0a86b22e3:0x2205049e991c160b!8m2!3d40.4435113!4d-3.6972595!16s%2Fg%2F11ckbpwl11!19sChIJ4yJrqPAoQg0RCxYcmZ4EBSI?authuser=0&hl=en&rclk=1,CDP Arquitectos,Architecture firm,"C. de Alonso Cano, 66, Chamberí, 28003 Madrid",{},{},https://www.cdparquitectos.es/,,C8V3+C3 Madrid,5,4.800000,"{""1"":0,""2"":0,""3"":0,""4"":1,""5"":4}",40.443511,-3.697259,2451370651393201675,,,,https://lh3.googleusercontent.com/p/AF1QipOBmwW-CR9FYU_LgLP14xzWa925T29uX-NOMXEF=w408-h271-k-no,Europe/Madrid,,0xd4228f0a86b22e3:0x2205049e991c160b,"[{""title"":""All"",""image"":""https://lh3.googleusercontent.com/p/AF1QipOBmwW-CR9FYU_LgLP14xzWa925T29uX-NOMXEF=w447-h298-k-no""},{""title"":""By owner"",""image"":""https://lh3.googleusercontent.com/p/AF1QipOS2oL53Li9SAwMhpDI4i707D4OkQ2TGAGJsXeg=w298-h298-k-no""},{""title"":""Street View \u0026 360°"",""image"":""https://streetviewpixels-pa.googleapis.com/v1/thumbnail?panoid=wZSi_Qr4WguxKCbmAls4xA\u0026cb_client=maps_sv.tactile.gps\u0026w=224\u0026h=298\u0026yaw=74.54945\u0026pitch=0\u0026thumbfov=100""}]",null,null,"{""link"":"""",""source"":""""}","{""id"":""112440674561466354005"",""name"":""CDP Arquitectos (Owner)"",""link"":""https://www.google.com/maps/contrib/112440674561466354005""}","{""borough"":""Chamberí"",""street"":""C. de Alonso Cano, 66"",""city"":""Madrid"",""postal_code"":""28003"",""state"":""Madrid"",""country"":""ES""}",null,"[{""Name"":""Jaime Guisasola"",""ProfilePicture"":""https://lh3.googleusercontent.com/a-/ALV-UjUc3MS_1Y7mhgwFcs18JWP-QXeZ9rGZWGt1Ne39yfgTo-fvJnVC=s120-c-rp-mo-ba5-br100"",""Rating"":5,""Description"":""Gente joven y con buen gusto. El proyecto de mi casa lo hicieron ellos."",""Images"":null,""When"":""""},{""Name"":""Pelayo del Valle"",""ProfilePicture"":""https://lh3.googleusercontent.com/a/ACg8ocIuDFjIc-JLdc6BAZGAFj_VbYPGyku4NH6ApM0Il3W73-MSzg=s120-c-rp-mo-br100"",""Rating"":5,""Description"":"""",""Images"":null,""When"":""""},{""Name"":""clara ybanez"",""ProfilePicture"":""https://lh3.googleusercontent.com/a/ACg8ocKQlqljap-HM-O9ODnXpfvYiyKVHWQWTy-jLfsswSMU--w3vg=s120-c-rp-mo-br100"",""Rating"":5,""Description"":"""",""Images"":null,""When"":""""},{""Name"":""Cristina Serna García-Conde"",""ProfilePicture"":""https://lh3.googleusercontent.com/a/ACg8ocLJAEUm0WVTFqf7REEiqxkC1WU-OVXRzR2SfjCMiF6_6W4niA=s120-c-rp-mo-br100"",""Rating"":5,""Description"":"""",""Images"":null,""When"":""""},{""Name"":""Rubén Fernández Arenas"",""ProfilePicture"":""https://lh3.googleusercontent.com/a-/ALV-UjU_QGDCXYqr8kyacsISTisFOPeJw-LduYAsSRtuf28Txe9nkdI7=s120-c-rp-mo-ba6-br100"",""Rating"":4,""Description"":"""",""Images"":null,""When"":""""}]",null,
aa99fea3-3573-4aa6-a383-e5337b7f6609,https://www.google.com/maps/place/Arquitectos+Madrid+2.0+-+Reformas+Integrales+Madrid/data=!4m7!3m6!1s0xd4228dfad6d3c4b:0xc3ac263e6b812471!8m2!3d40.4170457!4d-3.6755132!16s%2Fg%2F1pzr5h5r_!19sChIJSzxtrd8oQg0RcSSBaz4mrMM?authuser=0&hl=en&rclk=1,Arquitectos Madrid 2.0 - Reformas Integrales Madrid,Remodeler,"C/ del Alcalde Sainz de Baranda, 19, Retiro, 28009 Madrid","{""Friday"":[""9:30 am–2:30 pm""],""Monday"":[""9:30 am–2 pm"",""3–6:30 pm""],""Saturday"":[""Closed""],""Sunday"":[""Closed""],""Thursday"":[""9:30 am–2 pm"",""3–6:30 pm""],""Tuesday"":[""9:30 am–2 pm"",""3–6:30 pm""],""Wednesday"":[""9:30 am–2 pm"",""3–6:30 pm""]}",{},https://www.arquitectosmadrid20.com/,919 20 85 27,C88F+RQ Madrid,93,4.900000,"{""1"":1,""2"":0,""3"":0,""4"":3,""5"":89}",40.417046,-3.675513,14099686582923633777,,,,https://lh3.googleusercontent.com/p/AF1QipNMjmj0baPEbSYdTqfGQrLTMT4WiHYC0QPJKbF_=w408-h272-k-no,Europe/Madrid,,0xd4228dfad6d3c4b:0xc3ac263e6b812471,"[{""title"":""All"",""image"":""https://lh3.googleusercontent.com/p/AF1QipNMjmj0baPEbSYdTqfGQrLTMT4WiHYC0QPJKbF_=w446-h298-k-no""},{""title"":""Inside"",""image"":""https://lh3.googleusercontent.com/p/AF1QipOQzbJnKbawszkWCYyAdnCewo_sy7TeiUmjnjJg=w447-h298-k-no""},{""title"":""By owner"",""image"":""https://lh3.googleusercontent.com/p/AF1QipPITkmSk2ptBeAK7tQUTyRVYh5utEJnlbW9nvW1=w529-h298-k-no""},{""title"":""Street View \u0026 360°"",""image"":""https://streetviewpixels-pa.googleapis.com/v1/thumbnail?panoid=y7KPqTbt8juRtXvnGAMggw\u0026cb_client=maps_sv.tactile.gps\u0026w=224\u0026h=298\u0026yaw=355.10474\u0026pitch=0\u0026thumbfov=100""}]",null,"[{""link"":""https://www.arquitectosmadrid20.com/blog/contacto-arquitectos-madrid-2-0/"",""source"":""arquitectosmadrid20.com""}]","{""link"":"""",""source"":""""}","{""id"":""112628048022265942080"",""name"":""Arquitectos Madrid 2.0 - Reformas Integrales Madrid (Owner)"",""link"":""https://www.google.com/maps/contrib/112628048022265942080""}","{""borough"":""Retiro"",""street"":""C/ del Alcalde Sainz de Baranda, 19"",""city"":""Madrid"",""postal_code"":""28009"",""state"":""Madrid"",""country"":""ES""}","[{""id"":""service_options"",""name"":""Service options"",""options"":[{""name"":""Online estimates"",""enabled"":true},{""name"":""On-site services"",""enabled"":true},{""name"":""Language assistance"",""enabled"":false}]},{""id"":""accessibility"",""name"":""Accessibility"",""options"":[{""name"":""Wheelchair-accessible entrance"",""enabled"":true},{""name"":""Wheelchair-accessible seating"",""enabled"":true},{""name"":""Wheelchair-accessible toilet"",""enabled"":false}]},{""id"":""amenities"",""name"":""Amenities"",""options"":[{""name"":""Gender-neutral toilets"",""enabled"":true}]},{""id"":""crowd"",""name"":""Crowd"",""options"":[{""name"":""LGBTQ+ friendly"",""enabled"":true},{""name"":""Transgender safe space"",""enabled"":true}]}]","[{""Name"":""Andreika Zupanc"",""ProfilePicture"":""https://lh3.googleusercontent.com/a/ACg8ocKeSu57MjNkd731xV9zqdQwfL_QuDnp9YCuQemqMkOmfTI7bw=s120-c-rp-mo-br100"",""Rating"":5,""Description"":""Ya habíamos trabajado en la reforma completa de nuestra casa con el equipo y quedamos sumamente complacidos.\nRecientemente he reformado y transformado un local comercial en estudio de pilates y ha sido una experiencia EXCELENTE!!!\nCalidad profesional intachable!! Han comprendido de inmediato tanto nuestras necesidades funcionales como los requerimientos estéticos.\nSUPER RECOMENDABLES!!!!"",""Images"":[""www.google.com/local/imagery/report/?cb_client=maps_sv.tactile\u0026image_key=!1e10!2sCIABIhC6w-wlIXYgmml4bqt0dNuw\u0026fid=0x0:0xc3ac263e6b812471""],""When"":""2025-10-17""},{""Name"":""ana"",""ProfilePicture"":""https://lh3.googleusercontent.com/a/ACg8ocIr96U1Xrj2tOCpeg5-NKtxVYqcD69Nnj4V5KyIJuY9zApRpQ=s120-c-rp-mo-br100"",""Rating"":5,""Description"":""Puse toda la confianza en la reforma integral de mi casa en este equipo de grandes profesionales. Fue un acierto.  Tomás me dio la seguridad para  no pensarlo más y quedarme con ellos. Gracias a Marian por acompañarme y aconsejarme con los materiales y distribución de mi nueva casa, gracias y mil gracias a Silvia por el maravilloso resultado, por su paciencia y por hacerlo todo tan fácil. Han cumplido con los tiempos y con todas mis expectativas. Gracias a todo el equipo que ha hecho posible que me sienta tan contenta con mi nuevo hogar."",""Images"":null,""When"":""""},{""Name"":""Maria Jose Muñoz"",""ProfilePicture"":""https://lh3.googleusercontent.com/a/ACg8ocJncfmA_KZIp2RWHjrQoULruuRHVxnDxdWHAZWM2B3hknvV4w=s120-c-rp-mo-br100"",""Rating"":5,""Description"":""Hemos hecho una reforma total del apartamento. Nos ofrecieron varios proyectos para elegir, todos estupendos e incluso incluyeron algunas de nuestras ideas q no eran faciles de conseguir.  Gracias a todo el equipo en especial a Silvia q ha estado muy pendiente de que todo saliera bien y nos ha dedicado mucho tiempo. Gracias por hacer de mi casa un hogar de ensueño."",""Images"":null,""When"":""""},{""Name"":""Jose Luis Casas"",""ProfilePicture"":""https://lh3.googleusercontent.com/a/ACg8ocLcqSrA1zj3BD6OIxsgevLnxQtdDZqqNTBkgKQFr3I3CSxr3w=s120-c-rp-mo-br100"",""Rating"":5,""Description"":""Hemos acabado recientemente una reforma completa de un piso con ellos y hemos quedado MUY contentos. Silvia, que ha sido la persona con la que más hemos interactuado, es una persona muy profesional que nos ha hecho todo el proceso muy fácil y agradable. Lo mismo de Marian que nos ha ayudado muchísimo en la elección de materiales, armarios y demás. Tomás ha  aparecido las 3 ó 4 veces que ha sido necesario y resuelto lo que tenía que resolver. Un pedazo de equipo técnico, de gestión y humano. Han cumplido estrictamente todo lo acordado, incluido el plazo de entrega. Recomendables 100% sin ninguna duda"",""Images"":null,""When"":""""},{""Name"":""Alberto Torres"",""ProfilePicture"":""https://lh3.googleusercontent.com/a-/ALV-UjVpz5j81QIEY2zQ4cyrpQ28iCiGfb1vZk3Z0vpMBPyVlXhYtY8i=s120-c-rp-mo-ba3-br100"",""Rating"":5,""Description"":""¡Un estudio de arquitectura supercompetente y profesional!  Es un verdadero placer tratar tanto con Tomás como con Luis.\n\nLlevamos trabajando y colaborando ya 9 años de evolución en el que las sinergias y los proyectos comunes han sido realmente interesantes, y lo mejor de todo, son bellísimas personas. Da gusto el trato humano y como saben encontrar solución a todos los imprevistos que surgen en los proyectos. ¡¡¡ Enhorabuena !!!"",""Images"":[""www.google.com/local/imagery/report/?cb_client=maps_sv.tactile\u0026image_key=!1e10!2sCIHM0ogKEICAgICE09jO3wE\u0026fid=0x0:0xc3ac263e6b812471""],""When"":""2019-5-28""},{""Name"":""Jorge Oulego"",""ProfilePicture"":""https://lh3.googleusercontent.com/a/ACg8ocKGt7ujbStImVgEevs39lc9I2Z59gZHibYz7avE0IHNTfq5zQ=s120-c-rp-mo-br100"",""Rating"":5,""Description"":""Elegimos esta compañía por las referencias que habíamos leído (aunque algunos nos decían que sin conocer referencias directas era muy arriesgado) Todo el que ha hecho obras sabe el lío que son...\nTras la entrevista con Tomás lo tuvimos más claro y puedo decir que acertamos al 100%.\n\nTeníamos un plazo cerrado y muy ajustado para hacer una reforma integral de un piso y CUMPLIERON LA FECHA, aún con los cambios que se iban produciendo (nuestros y de las sorpresas de la obra). Con eso lo digo todo.\n\nHicieron un buen seguimiento durante la obra y te asesoran mucho y bien. Trabajan bien, porque su personal trabaja con ellos y siempre son los mismos, todos se conocen y son profesionales.\n\nNo conozco a nadie que recomiende a un reformista a ojos cerrados, NADIE, siempre hay peros. En este caso yo lo recomiendo directamente.\n\nY por si esto no es suficiente, una vez pagado la obra, si tienes un problema, se implican para solucionarlo, ellos o sus proveedores.\n\nPoco más puedo decir.  Ha sido un placer trabajar con vosotros  :)"",""Images"":[""www.google.com/local/imagery/report/?cb_client=maps_sv.tactile\u0026image_key=!1e10!2sCIHM0ogKEICAgID4mNG0MQ\u0026fid=0x0:0xc3ac263e6b812471""],""When"":""2019-1-25""},{""Name"":""Luis Balaguer"",""ProfilePicture"":""https://lh3.googleusercontent.com/a-/ALV-UjVRzjzUIfrCZd9W3x5_L1Pa6H8uhXo25HcWASRWnhh4yiTdOgOU=s120-c-rp-mo-br100"",""Rating"":5,""Description"":""Hacer una reforma siempre es difícil pero mucho más si vives a miles de kilómetros y tienes que confiar en la empresa que realiza los trabajos.\n\nEn nuestro caso, al plantearnos la reforma de nuestra vivienda unifamiliar, nos decidimos por este estudio a pesar de la distancia porque las muestras de su trabajo encajaban perfectamente con lo que estábamos buscando y la experiencia fue perfectamente.\n\nLa comunicación a lo largo del proyecto fue impecable. Las reuniones a distancia no fueron un problema y el seguimiento de la obra tampoco.\n\nAcabamos muy contentos con el trabajo de Javier y de Luis. Llegar a mi casa de toda la vida totalmente cambiada fue una experiencia increíble. 100% recomendado."",""Images"":null,""When"":""""},{""Name"":""Pilar R."",""ProfilePicture"":""https://lh3.googleusercontent.com/a/ACg8ocKG8r_29muUgVFIkqxB22-qqmQiTVqgq9I5-IUOMPAV1QuqDXo=s120-c-rp-mo-ba3-br100"",""Rating"":5,""Description"":""Hice la reforma de mi casa de Madrid con Luis y Tomás y acabé encantada. Disfruté todo el proceso, desde las distintas opciones iniciales para la casa hasta el resultado final, pasando por la elección de materiales y el seguimiento de la obra. Repetiría si tuviese otra casa."",""Images"":null,""When"":""""}]",null,
aa99fea3-3573-4aa6-a383-e5337b7f6609,https://www.google.com/maps/place/Alberich-Rodriguez+Arquitectos+-+Estudio+de+Arquitectura+en+Madrid/data=!4m7!3m6!1s0xd4226022fa9085f:0x8bf5993a0dc54bb9!8m2!3d40.4119549!4d-3.6678691!16s%2Fg%2F11c6prpzd4!19sChIJXwipLwImQg0RuUvFDTqZ9Ys?authuser=0&hl=en&rclk=1,Alberich-Rodriguez Arquitectos - Estudio de Arquitectura en Madrid,Architecture firm,"C. de la Cruz del Sur, 3, Local 1, Retiro, 28007 Madrid","{""Friday"":[""9 am–8 pm""],""Monday"":[""9 am–8 pm""],""Saturday"":[""Closed""],""Sunday"":[""Closed""],""Thursday"":[""9 am–8 pm""],""Tuesday"":[""9 am–8 pm""],""Wednesday"":[""9 am–8 pm""]}",{},http://www.alberich-rodriguez.com/,915 73 84 17,C86J+QV Madrid,19,4.800000,"{""1"":1,""2"":0,""3"":0,""4"":0,""5"":18}",40.411955,-3.667869,10085135415184280505,,,,https://lh3.googleusercontent.com/p/AF1QipNheo3-yX6OgbUNS6UU_ip83yiMlx8YWqHL8bXM=w408-h306-k-no,Europe/Madrid,,0xd4226022fa9085f:0x8bf5993a0dc54bb9,"[{""title"":""All"",""image"":""https://lh3.googleusercontent.com/p/AF1QipNheo3-yX6OgbUNS6UU_ip83yiMlx8YWqHL8bXM=w396-h298-k-no""},{""title"":""Inside"",""image"":""https://lh3.googleusercontent.com/p/AF1QipMwJr2gc010MjQSTdEqoiDrMxVjaM15DZgAjQio=w462-h298-k-no""},{""title"":""Home"",""image"":""https://lh3.googleusercontent.com/p/AF1QipNheo3-yX6OgbUNS6UU_ip83yiMlx8YWqHL8bXM=w396-h298-k-no""},{""title"":""By owner"",""image"":""https://lh3.googleusercontent.com/p/AF1QipNgsKV0QPWnkrIXM0HsZLifw6vOctA5MJFHYToI=w443-h298-k-no""},{""title"":""Street View \u0026 360°"",""image"":""https://streetviewpixels-pa.googleapis.com/v1/thumbnail?panoid=pP_Cnv_yC8Wrb8eIecIqwA\u0026cb_client=maps_sv.tactile.gps\u0026w=224\u0026h=298\u0026yaw=97.171165\u0026pitch=0\u0026thumbfov=100""}]",null,null,"{""link"":"""",""source"":""""}","{""id"":""104082090006227886599"",""name"":""Alberich-Rodriguez Arquitectos - Estudio de Arquitectura en Madrid (Owner)"",""link"":""https://www.google.com/maps/contrib/104082090006227886599""}","{""borough"":""Retiro"",""street"":""C. de la Cruz del Sur, 3, Local 1"",""city"":""Madrid"",""postal_code"":""28007"",""state"":""Madrid"",""country"":""ES""}",null,"[{""Name"":""CIDEAM BIKE"",""ProfilePicture"":""https://lh3.googleusercontent.com/a-/ALV-UjUx44wJNqpydc1NkxRV2jN5eaZ5gyeIN_D889qvZl5ad8OIK7UY3g=s120-c-rp-mo-ba4-br100"",""Rating"":5,""Description"":""Una de los estudios con más renombre y experiencia en Madrid enfocados en el sector residencial."",""Images"":null,""When"":""""},{""Name"":""Juan Felipe Holgado Perez"",""ProfilePicture"":""https://lh3.googleusercontent.com/a-/ALV-UjXhjZndUDDJIhhlHoHmiheYuG8qqW3iPcDWYlj3NC1bdiBQ-Ma7=s120-c-rp-mo-ba8-br100"",""Rating"":5,""Description"":""Excelentes proyectos"",""Images"":null,""When"":""""},{""Name"":""alvaro domingo"",""ProfilePicture"":""https://lh3.googleusercontent.com/a-/ALV-UjXvILy_NNEhgSXHTF3jN6mp0fS_ZsgNx85NbOj51vroddlJrBM=s120-c-rp-mo-br100"",""Rating"":5,""Description"":""Grandes Arquitectos!"",""Images"":null,""When"":""""},{""Name"":""FRANCISCO BALLESTERO"",""ProfilePicture"":""https://lh3.googleusercontent.com/a/ACg8ocI3y3IFwPOZU_0Ha8uph0WM638hYSS5icpnLIPuk_lSKbDqew=s120-c-rp-mo-br100"",""Rating"":5,""Description"":"""",""Images"":null,""When"":""""},{""Name"":""Silvia Babé Villanueva"",""ProfilePicture"":""https://lh3.googleusercontent.com/a-/ALV-UjX072Ccz4SGSyKVROrlBdySW6zTA2HYM5wL-vuYXA3tvTGV9b8=s120-c-rp-mo-br100"",""Rating"":5,""Description"":"""",""Images"":null,""When"":""""},{""Name"":""Amdrea Sánchez"",""ProfilePicture"":""https://lh3.googleusercontent.com/a/ACg8ocKSiys8hQEPGUB3hfXx6QoNAPehFyGaf7r-O-14wSSHv1aKSg=s120-c-rp-mo-br100"",""Rating"":5,""Description"":"""",""Images"":null,""When"":""""},{""Name"":""Reynald Pérez Copello"",""ProfilePicture"":""https://lh3.googleusercontent.com/a/ACg8ocK-1oU7OZ_v5p_DXZ5Zl-sU_wOIaWw7qeP55HZ4KINBWuJUZQ=s120-c-rp-mo-br100"",""Rating"":5,""Description"":"""",""Images"":null,""When"":""""},{""Name"":""Carmen Miranda"",""ProfilePicture"":""https://lh3.googleusercontent.com/a/ACg8ocJO2_CRFj7SXoVoJCZ6_7eaR3yIv8X5GZA5qDeRRaBoWyHSWw=s120-c-rp-mo-br100"",""Rating"":5,""Description"":"""",""Images"":null,""When"":""""}]",null,
aa99fea3-3573-4aa6-a383-e5337b7f6609,https://www.google.com/maps/place/M%C3%B3naco+Arquitectos+SL+Madrid/data=!4m7!3m6!1s0x4c1256d5432f87f5:0x3bd5c22da5a35f9!8m2!3d40.4244278!4d-3.6846646!16s%2Fg%2F11w351w7sd!19sChIJ9YcvQ9VWEkwR-TVa2iJcvQM?authuser=0&hl=en&rclk=1,Mónaco Arquitectos SL Madrid,Architect,"Calle Velázquez, 27, 1º EXTERIOR IZQUIERDA, Salamanca, 28001 Madrid","{""Friday"":[""9 am–2 pm"",""4–7 pm""],""Monday"":[""9 am–2 pm"",""4–7 pm""],""Saturday"":[""Closed""],""Sunday"":[""Closed""],""Thursday"":[""9 am–2 pm"",""4–7 pm""],""Tuesday"":[""9 am–2 pm"",""4–7 pm""],""Wednesday"":[""9 am–2 pm"",""4–7 pm""]}",{},https://www.monacoarquitectos.com/,914 32 09 02,C8F8+Q4 Madrid,15,5.000000,"{""1"":0,""2"":0,""3"":0,""4"":0,""5"":15}",40.424428,-3.684665,269472857474086393,,,,https://lh3.googleusercontent.com/p/AF1QipOL6O_vfP679bkankv18AJlwFWZFcSL0DwzLRO2=w426-h240-k-no,Europe/Madrid,,0x4c1256d5432f87f5:0x3bd5c22da5a35f9,"[{""title"":""All"",""image"":""https://lh3.googleusercontent.com/p/AF1QipOL6O_vfP679bkankv18AJlwFWZFcSL0DwzLRO2=w529-h298-k-no""},{""title"":""Inside"",""image"":""https://lh3.googleusercontent.com/p/AF1QipP_9rf_qwpITny7hTkkIde0kMOEvzm5XFc7T6pO=w447-h298-k-no""},{""title"":""By owner"",""image"":""https://lh3.googleusercontent.com/p/AF1QipMJDrifP39-6HJfSYfqA4-CtnvmiT4-AB_bhZ4V=w447-h298-k-no""},{""title"":""Street View \u0026 360°"",""image"":""https://streetviewpixels-pa.googleapis.com/v1/thumbnail?panoid=XVU50Q0i3VmMX2_0AGaa6w\u0026cb_client=maps_sv.tactile.gps\u0026w=224\u0026h=298\u0026yaw=272.27048\u0026pitch=0\u0026thumbfov=100""}]",null,null,"{""link"":"""",""source"":""""}","{""id"":""112744913994460002597"",""name"":""Mónaco Arquitectos SL Madrid (Owner)"",""link"":""https://www.google.com/maps/contrib/112744913994460002597""}","{""borough"":""Salamanca"",""street"":""Calle Velázquez, 27, 1º EXTERIOR IZQUIERDA"",""city"":""Madrid"",""postal_code"":""28001"",""state"":""Madrid"",""country"":""ES""}","[{""id"":""service_options"",""name"":""Service options"",""options"":[{""name"":""Online appointments"",""enabled"":true},{""name"":""On-site services"",""enabled"":true},{""name"":""Language assistance"",""enabled"":false}]},{""id"":""accessibility"",""name"":""Accessibility"",""options"":[{""name"":""Wheelchair-accessible seating"",""enabled"":true},{""name"":""Wheelchair-accessible toilet"",""enabled"":true},{""name"":""Assistive hearing loop"",""enabled"":false}]},{""id"":""amenities"",""name"":""Amenities"",""options"":[{""name"":""Gender-neutral toilets"",""enabled"":true}]},{""id"":""crowd"",""name"":""Crowd"",""options"":[{""name"":""LGBTQ+ friendly"",""enabled"":true}]},{""id"":""planning"",""name"":""Planning"",""options"":[{""name"":""Appointment required"",""enabled"":true}]},{""id"":""parking"",""name"":""Parking"",""options"":[{""name"":""Free multi-storey car park"",""enabled"":true},{""name"":""Free of charge street parking"",""enabled"":true},{""name"":""Paid multi-storey car park"",""enabled"":true},{""name"":""Paid parking lot"",""enabled"":true},{""name"":""Paid street parking"",""enabled"":true}]}]","[{""Name"":""Carlos Maté"",""ProfilePicture"":""https://lh3.googleusercontent.com/a/ACg8ocLrnVHayE3AvoJUnP4HQjok6uIGA3fJezl6DeZXyry8PqJ48A=s120-c-rp-mo-br100"",""Rating"":5,""Description"":""Espectacular equipo profesional y humano. El estudio y la reforma fueron de gran calidad, con muchas ideas y buenos consejos, y siempre adaptándose a nuestras necesidades. Trato exquisito y cercano, y muy profesionales desde el minuto uno.\nMuy recomendables. Los contraté por recomendación y volvería a hacerlo sin dudarlo, si lo necesitase.\n\nGracias a todo el equipo! Estamos encantados, parece que nos hemos mudado a una casa nueva y moderna. Para mi, marcáis la diferencia."",""Images"":null,""When"":""""},{""Name"":""Juan Perujo"",""ProfilePicture"":""https://lh3.googleusercontent.com/a/ACg8ocKYdP3JqtH0bYXbO1GmVIHf5No3REDCp2-ug65xtagpH8F5dw=s120-c-rp-mo-br100"",""Rating"":5,""Description"":""Mejor imposible !\nPedazo de grato !\nPedazo de casa !\nPedazo de proyecto!\nTrato inigualable !\nGracias chic@s\nGracias de verdad y desde el corazón !\nOs recomendaré\nSaludos"",""Images"":null,""When"":""""},{""Name"":""MANZANA ROTA TV"",""ProfilePicture"":""https://lh3.googleusercontent.com/a-/ALV-UjWqER3q28R2NayEZrqhGcriv9AtnP47iXw4hSkCRLyNlNe1NA=s120-c-rp-mo-ba2-br100"",""Rating"":5,""Description"":""Encantados con  el último proyectazo que nos habéis hecho . Repetiremos y muy aconsejables"",""Images"":null,""When"":""""},{""Name"":""Lucia Kleiner"",""ProfilePicture"":""https://lh3.googleusercontent.com/a-/ALV-UjVxY3tBpJMr4gsUsLiatPCP-PIwXoVBdiX6xWTEosSyKzs6g7EBPw=s120-c-rp-mo-br100"",""Rating"":5,""Description"":""Super agradecida por el maravilloso trabajo que habeis hecho en casa de mi familia!! Super amables y profesionales 🤩"",""Images"":null,""When"":""""},{""Name"":""JP Ccc"",""ProfilePicture"":""https://lh3.googleusercontent.com/a/ACg8ocIr8uhCsJ1pZ9cHnaPBbfC6GBf3GVi59lBKzt_B5M-yzHweYw=s120-c-rp-mo-ba2-br100"",""Rating"":5,""Description"":""Muchas gracias por el magnífico trabajo y por entender todas nuestras necesidades desde el primer momento"",""Images"":null,""When"":""""},{""Name"":""Isabel Lojo"",""ProfilePicture"":""https://lh3.googleusercontent.com/a/ACg8ocIda8_jU0syVtSZEllF6jXcMvKF-agyN61cwbXthFoQoZTaJw=s120-c-rp-mo-br100"",""Rating"":5,""Description"":""Que barbaridad de diseños  muchas gracias por vuestro trabajo de adecuación de nuestro negocio restaurante y hotel , todo el mundo que lo visita , alucina y es que no puede ser de otra manera , repetiremos"",""Images"":null,""When"":""""},{""Name"":""Elenabuzo6"",""ProfilePicture"":""https://lh3.googleusercontent.com/a-/ALV-UjUIWUY22Fr5DIoHu3WZ7w2VzcHnP3kwYcL0F2EHo-wZIGPMztLB=s120-c-rp-mo-br100"",""Rating"":5,""Description"":""100% profesionalidad. Trato directo y cercano. Expectativas superadas con creces. Si volviera a necesitar un profesional volvería a contactar con ellos."",""Images"":null,""When"":""""},{""Name"":""Robert Sayago"",""ProfilePicture"":""https://lh3.googleusercontent.com/a/ACg8ocJ0voQU14nUnDdUT-eDa6e5NGY8M6zkN9ZBSLyLlQNyYhBgcA=s120-c-rp-mo-br100"",""Rating"":5,""Description"":""Mi pareja y yo estamos encantados con los proyectos que nos han hecho. Mil gracias."",""Images"":null,""When"":""""}]",null,
