input_id,link,title,category,address,open_hours,popular_times,website,phone,plus_code,review_count,review_rating,reviews_per_rating,latitude,longitude,cid,status,descriptions,reviews_link,thumbnail,timezone,price_range,data_id,images,reservations,order_online,menu,owner,complete_address,about,user_reviews,user_reviews_extended,emails
aa99fea3-3573-4aa6-a383-e5337b7f6609,https://www.google.com/maps/place/GMT+Arquitectura+%26+Dise%C3%B1o/data=!4m7!3m6!1s0xd42262a22519f27:0xf4ab6cc10f9d67c1!8m2!3d40.4118047!4d-3.6984395!16s%2Fg%2F11cs5_jb82!19sChIJJ59RIiomQg0RwWedD8Fsq_Q?authuser=0&hl=en&rclk=1,GMT Arquitectura & Diseño,Architecture firm,"C. del Duque de Fernán Núñez, 2, Planta 4, Oficina 1, Centro, 28012 Madrid","{""Friday"":[""9 am–6 pm""],""Monday"":[""9 am–8 pm""],""Saturday"":[""Closed""],""Sunday"":[""Closed""],""Thursday"":[""9 am–8 pm""],""Tuesday"":[""9 am–8 pm""],""Wednesday"":[""9 am–8 pm""]}",{},http://gmtmasarquitectos.com/,635 58 61 42,C862+PJ Madrid,31,4.700000,"{""1"":2,""2"":0,""3"":0,""4"":2,""5"":27}",40.411805,-3.698439,17630304742718400449,,,,https://lh3.googleusercontent.com/p/AF1QipOcfoetHcayLGO4ya8RsaxJ44paqCKrVxT1Dywf=w408-h272-k-no,Europe/Madrid,,0xd42262a22519f27:0xf4ab6cc10f9d67c1,"[{""title"":""All"",""image"":""https://lh3.googleusercontent.com/p/AF1QipOcfoetHcayLGO4ya8RsaxJ44paqCKrVxT1Dywf=w447-h298-k-no""},{""title"":""Inside"",""image"":""https://lh3.googleusercontent.com/p/AF1QipNA8fxJ9jj-LPM1cpKp5I-3ltB25rn4xkQzdLEo=w447-h298-k-no""},{""title"":""Kitchen"",""image"":""https://lh3.googleusercontent.com/gps-cs-s/AHVAwep3Les923d6ezT_1rJi7aOXwvzQEePavR_-qy1VEREw6JJazGCSz2m7PQ7VRa6bwj-h50nTzvwVGDg2WCgF3YJHCu1qnBvuK6NuDdHhpQgjQC6cfF4J6nbx1UQuFrFZxYo2lm0=w224-h298-k-no""},{""title"":""By owner"",""image"":""https://lh3.googleusercontent.com/p/AF1QipNavWbW-5KELsFkjpf15E3bCwCK_zhzp8CiTMQ0=w447-h298-k-no""},{""title"":""Street View \u0026 360°"",""image"":""https://streetviewpixels-pa.googleapis.com/v1/thumbnail?panoid=51ZeKBn7LAbMb_o5UScPjA\u0026cb_client=maps_sv.tactile.gps\u0026w=224\u0026h=298\u0026yaw=292.2397\u0026pitch=0\u0026thumbfov=100""}]",null,null,"{""link"":"""",""source"":""""}","{""id"":""109583087682477329967"",""name"":""GMT Arquitectura \u0026 Diseño (Owner)"",""link"":""https://www.google.com/maps/contrib/109583087682477329967""}","{""borough"":""Centro"",""street"":""C. del Duque de Fernán Núñez, 2, Planta 4, Oficina 1"",""city"":""Madrid"",""postal_code"":""28012"",""state"":""Madrid"",""country"":""ES""}","[{""id"":""service_options"",""name"":""Service options"",""options"":[{""name"":""Online appointments"",""enabled"":true},{""name"":""On-site services"",""enabled"":true}]},{""id"":""planning"",""name"":""Planning"",""options"":[{""name"":""Appointment required"",""enabled"":true}]}]","[{""Name"":""St Jo"",""ProfilePicture"":""https://lh3.googleusercontent.com/a/ACg8ocJVkhOb3GLzMxxD1xHihxzWrFrtD_FK7s_o_B-oIkHn_fVKUQ=s120-c-rp-mo-ba2-br100"",""Rating"":5,""Description"":""I learned the hard way that home renovations can be challenging: My previous experience was fraught with delays (12 instead of 3 months), legal issues as the Contractor just stopped work and disappeared with the money and emotional stress, leaving me wary of Contractors in Madrid who often overpromise and underdeliver. However, my experience with GMT+ was a refreshing contrast.\n\nSergio and his team completed the renovation of our 146m² apartment in just four months, slightly under budget while incorporating all our wishes we had during the renovation. Sergio’s proactive communication and guidance made the process seamless and very pleasant. To date, we have encountered no issues thanks to the profesional workmanship and high-quality materials used. I very much appreciate being able to reach out to him anytime for advice on questions I have on properties I consider buying.\n\nSergio and his team are true professionals and GMT+ deserves their success. Thank you, Sergio!"",""Images"":[""www.google.com/local/imagery/report/?cb_client=maps_sv.tactile\u0026image_key=!1e10!2sCIHM0ogKEICAgIDXkYu5BQ\u0026fid=0x0:0xf4ab6cc10f9d67c1""],""When"":""2024-10-28""},{""Name"":""Jad Khalife"",""ProfilePicture"":""https://lh3.googleusercontent.com/a-/ALV-UjUBG8Bq6AEz_jr736_uMWDbvv39hLaDn-RMDE6Y6D6KN6ngDi4Y=s120-c-rp-mo-br100"",""Rating"":5,""Description"":""Renovating a property is never a fun experience and being remote doesn't make it easier. GMT did make the whole experience very smooth and renovated an apartment i had bought within time and the budget allocated.\n\nI used the services of GMT to renovate a property i bought in Madrid and which i was planning to rent out. I had doubts on how the renovation will go/whether the contractor will meet the timelines. Luckily for me, GMT made the experience very smooth. The team sat with me to understand my requirements (what my plan is for the apartment) and timelines/budget. They put together a plan and shared ahead of time the expected timelines.\nRaul was always responsive; asked for my input whenever needed and always provideed updates on progress.\nThe end result was extremely satisfactory and i was able to rent the apartment in few weeks.\nThank you Raul and team!"",""Images"":null,""When"":""""},{""Name"":""ALBERTO Ibiza"",""ProfilePicture"":""https://lh3.googleusercontent.com/a/ACg8ocKK38OZjYcH3CKvK59nAi2EMHQVoCZjo6wcrk8yUiosgBcwSQ=s120-c-rp-mo-ba4-br100"",""Rating"":1,""Description"":""No se ni por dónde empezar , fue un desastre absoluto . Muy mal trabajo . Primero todo bien con Sergio , te vende la moto como super profesional , luego cuando firmas jamás vuelve a la obra , te pone una persona recién salida de la carrera con cero experiencia y sin todo problemas . Primero ponen y quiten albañiles según su conveniencia , la obra no avanza , luego un fontanero peor de lo peor , todo mal instalado , reventón, parque de madera destrozado , gastaron todo mi stock y luego decían que no había sobrado , pero empleados me contaron lo que había pasado , grifos que pierden agua , el de la ducha lo dejaron muy adentro empotrado y todo problemas siempre , la mampara la hicieron a medida y sale agua fuera por varios sitios . Hicieron\nUn diseño destrozado baño muy mal hecho , yo avisé y decían que mi idea  no les gustaba , hicimos la suya , al final pagar doble presupuesto y hacer mi idea que veían más cómoda y bonito . Puerta correderas que descarrilan cada día . Ventana puesta torcida junto a máquina de aire también torcido . Todo fue un despropósito y he tardado en escribirlo porque todavía confiaba en que lo arreglarían . Ni gratis los vuelvo a contratar porque además mucha chuleria cuando te quejas de algo .\nCon vuestra respuesta queda claro lo que\nIndico , tengo fotos de todo y conversaciones con clara . Nunca hemos alquilado ni vamos a alquilar . Y las humedades de cocina fueron tus fontaneros trabajo mal hecho , puedo adjuntar conversación donde me lo dijo la aprendiz de arquitecto , y he tardado porque me enviaste a un chico a ver la mampara y me dijo que me llamaría y ahí seguimos . Y yo no debo nada , se cerraron las cuentas y gastasteis todo el parque que compré extra o os lo llevasteis que no creo porque me dijeron\nSe había tenido que usar por el\nReventón en la cocina . Y yo pongo reseña\nDonde no veo las cosas bien , es verdad que mayoritariamente es perfecto en todos lados pero ahí no pienso en google , a partir de ahora pensaré más ."",""Images"":[""www.google.com/local/imagery/report/?cb_client=maps_sv.tactile\u0026image_key=!1e10!2sCIABIhBA9sssIwVOVoFKSchqMOoO\u0026fid=0x0:0xf4ab6cc10f9d67c1""],""When"":""2025-9-23""},{""Name"":""M SM"",""ProfilePicture"":""https://lh3.googleusercontent.com/a/ACg8ocK63f-7FaL_VtghOXC0Q_4VsPgCluEAHR9lRTNV9csY-cdi=s120-c-rp-mo-br100"",""Rating"":5,""Description"":""Han hecho la reforma de mi vivienda y estoy muy contenta. No son perfectos, pero dudo mucho que haya alguien con mejor relación calidad/precio. Sergio es encantador, se ha implicado totalmente en la vivienda y ha peleado todas las incidencias, aunque no fueran responsabilidad de ellos. Los recomiendo sin duda"",""Images"":null,""When"":""""},{""Name"":""mariola montero"",""ProfilePicture"":""https://lh3.googleusercontent.com/a/ACg8ocIEC3oO7VJUBMnir-phM9vcA1V06sfH99tTUIYFDGxq-gZanA=s120-c-rp-mo-br100"",""Rating"":5,""Description"":""Son muy profesionales y están muy al día de tendencias, aunque sin tonterías y adaptándose increíblemente a tus gustos, si son más clásicos, como es mi caso. Los trabajos son de calidad y aunque siempre hay cosas que no llevan el ritmo que tú quieres (en qué obra no sucede eso?) no se olvidan de que el final ha de ser el óptimo y lo consiguen. Yo estoy feliz con el piso que me han dejado y eso que sufrí mucho cuando me dejé convencer de que lo echaran abajo. Sentido común, responsabilidad y muy buen gusto. Lo hacen todo todo y muy bonito. Gracias mil."",""Images"":null,""When"":""""},{""Name"":""Sofía Galán"",""ProfilePicture"":""https://lh3.googleusercontent.com/a-/ALV-UjX7E7FPI03uVSArZQFJmVkeAjJSae-GCrMIWAKIJBSFW174k-uL=s120-c-rp-mo-br100"",""Rating"":5,""Description"":""Soy asidua de programas como \""Los Hermanos Scott\"" y \""Reforma Integral\"". Fue en este último donde di con Sergio. Me sentía 100% identificada con el estilo y acabados de sus reformas, así que cuando adquirí mi casa y pedí presupuestos para su reforma, contacté con GMT. Ellos fueron los elegidos.\nDesde el primer momento la comunicación ha sido plena y no puedo estar más contenta con los resultados. La casa que compré es ahora mi hogar y me representa totalmente.\nGMT ha cumplido mis expectativas con creces. Si tuviera que hacer otra reforma integral, les contactaría de nuevo seguro.\nMuchas gracias a todo el equipo GMT, en especial a Sergio y a Emilio ;)."",""Images"":null,""When"":""""},{""Name"":""Mila Mila"",""ProfilePicture"":""https://lh3.googleusercontent.com/a/ACg8ocItkPbdffVXPfUrMCTrOxtS6OYXC5pJgU7g8MJCDSt9ACPGEQ=s120-c-rp-mo-br100"",""Rating"":5,""Description"":""He tenido varias reformas integrales,y  cuando decidimos hacer esta última me preocupaba como seria.  Escogimos Raul por los programas de la tv. Gracias a esto esta experiencia no fue nada como las anteriores. No nos tuvimos que preocupar de casi nada,aparte de elegir algunos detalles.  No estrés.  Gracias Raúl, por todo."",""Images"":null,""When"":""""},{""Name"":""Jesus Sj"",""ProfilePicture"":""https://lh3.googleusercontent.com/a/ACg8ocKCGVHoA2fMATmARhnsHXp3Upyk-zG1uheRsopHdv9ceE8ndw=s120-c-rp-mo-br100"",""Rating"":5,""Description"":""Sin duda una gran elección. Sergio es un profesional muy eficiente con un gran equipo. Para la reforma integral de una vivienda se ocupan de todo. Te aconsejan desde el principio para que al final veas un espectacular resultado."",""Images"":null,""When"":""""}]",null,
aa99fea3-3573-4aa6-a383-e5337b7f6609,https://www.google.com/maps/place/%C3%81rgola+Arquitectos/data=!4m7!3m6!1s0xd422861d3437ef3:0x954c65b9036e754c!8m2!3d40.430625!4d-3.703266!16s%2Fg%2F11ysklxjm!19sChIJ835D02EoQg0RTHVuA7llTJU?authuser=0&hl=en&rclk=1,Árgola Arquitectos,Architecture firm,"Calle de Fuencarral, 123, Chamberí, 28010 Madrid","{""Friday"":[""9 am–3 pm"",""4–7 pm""],""Monday"":[""9 am–3 pm"",""4–7 pm""],""Saturday"":[""Closed""],""Sunday"":[""Closed""],""Thursday"":[""9 am–3 pm"",""4–7 pm""],""Tuesday"":[""9 am–3 pm"",""4–7 pm""],""Wednesday"":[""9 am–3 pm"",""4–7 pm""]}",{},https://www.argolaarquitectos.com/,914 46 69 81,C7JW+6M Madrid,21,5.000000,"{""1"":0,""2"":0,""3"":0,""4"":0,""5"":21}",40.430625,-3.703266,10758085455182198092,,,,https://streetviewpixels-pa.googleapis.com/v1/thumbnail?panoid=Aauc7odvzSoW7HZ6hkqN2w&cb_client=search.gws-prod.gps&w=408&h=240&yaw=324.83005&pitch=0&thumbfov=100,Europe/Madrid,,0xd422861d3437ef3:0x954c65b9036e754c,"[{""title"":""All"",""image"":""https://streetviewpixels-pa.googleapis.com/v1/thumbnail?panoid=Aauc7odvzSoW7HZ6hkqN2w\u0026cb_client=maps_sv.tactile.gps\u0026w=224\u0026h=298\u0026yaw=324.83005\u0026pitch=0\u0026thumbfov=100""},{""title"":""By owner"",""image"":""https://lh3.googleusercontent.com/p/AF1QipOERChQj82_yxcrVNdEhQq_2hx8Mgo4_VxzciTO=w382-h298-k-no""},{""title"":""Street View \u0026 360°"",""image"":""https://streetviewpixels-pa.googleapis.com/v1/thumbnail?panoid=Aauc7odvzSoW7HZ6hkqN2w\u0026cb_client=maps_sv.tactile.gps\u0026w=224\u0026h=298\u0026yaw=324.83005\u0026pitch=0\u0026thumbfov=100""}]",null,null,"{""link"":"""",""source"":""""}","{""id"":""107679905999361498466"",""name"":""Árgola Arquitectos (Owner)"",""link"":""https://www.google.com/maps/contrib/107679905999361498466""}","{""borough"":""Chamberí"",""street"":""Calle de Fuencarral, 123"",""city"":""Madrid"",""postal_code"":""28010"",""state"":""Madrid"",""country"":""ES""}","[{""id"":""accessibility"",""name"":""Accessibility"",""options"":[{""name"":""Wheelchair-accessible entrance"",""enabled"":true}]}]","[{""Name"":""saveria casaus"",""ProfilePicture"":""https://lh3.googleusercontent.com/a-/ALV-UjWFysEqOAC3aum9d588dKtElIiQy6Y1eswjsRj_mSxPe9xTGU2W=s120-c-rp-mo-br100"",""Rating"":5,""Description"":""A team of great professionals that work internationally. I would defiantly recommend them for all your building and architectural needs."",""Images"":null,""When"":""""},{""Name"":""alejandraceno"",""ProfilePicture"":""https://lh3.googleusercontent.com/a-/ALV-UjVIdKiKL9acKYPREkI9bI9dmzmf6tkqqWH0mDmOOv5gIiWiCAHH=s120-c-rp-mo-ba3-br100"",""Rating"":5,""Description"":""He tenido el placer de encargarles un proyecto y su profesionalidad es impecable. La atención a cada detalle, inmejorable. Volveré a trabajar con ellos."",""Images"":null,""When"":""""},{""Name"":""Ju Blanco"",""ProfilePicture"":""https://lh3.googleusercontent.com/a-/ALV-UjVIU5RctLCs3LYnc_G5zQX5gRpY7BPjDvzIM64UUXHtdllOpI7O=s120-c-rp-mo-br100"",""Rating"":5,""Description"":""Encantada con el servicio y la profesionalidad. Y además, todo dentro de los plazos. Contaré con vosotros para futuros proyectos ☺️"",""Images"":null,""When"":""""},{""Name"":""Paula G G"",""ProfilePicture"":""https://lh3.googleusercontent.com/a-/ALV-UjWVfmczqnmfRrBs7y39hW7mo0wgT2WQlk_-blBWHLHEJxRG9lQ=s120-c-rp-mo-ba2-br100"",""Rating"":5,""Description"":""Muy profesionales. Trato muy bueno."",""Images"":null,""When"":""""},{""Name"":""Pablo García Zavala"",""ProfilePicture"":""https://lh3.googleusercontent.com/a-/ALV-UjXEckqQVCDK0DQ1SPTlgeHUVPWuyd7nKpChUFGpVio2A2RhIOVWcg=s120-c-rp-mo-ba2-br100"",""Rating"":5,""Description"":""Espectacular equipo de profesionales. Maxima confiabilidad"",""Images"":null,""When"":""""},{""Name"":""Greenery420 Canarias CBD SHOP"",""ProfilePicture"":""https://lh3.googleusercontent.com/a-/ALV-UjWFukF19hw0NcVTCTUPq0gMtU0Jnfik6vEntIo3Td9xQ6U5WVzf=s120-c-rp-mo-ba2-br100"",""Rating"":5,""Description"":""Un buen estudio, las personas son serias y realmente buen@s trabajador@s, muy recomendable. Gracias."",""Images"":null,""When"":""""},{""Name"":""J LF"",""ProfilePicture"":""https://lh3.googleusercontent.com/a-/ALV-UjXXQPGrzQh3GBafCehk1hYfZkCAK2Y-WIr6rWkonCtrLwQffqcybA=s120-c-rp-mo-ba3-br100"",""Rating"":5,""Description"":""Grandes profesionales. Altamente recomendables"",""Images"":null,""When"":""""},{""Name"":""Hugo"",""ProfilePicture"":""https://lh3.googleusercontent.com/a/ACg8ocLdlyD5wGG0nqciaLosHVVIndY10D_X5K571d7-F2fg4UA2yw=s120-c-rp-mo-ba2-br100"",""Rating"":5,""Description"":""Un gusto trabajar con ellos, muy profesionales."",""Images"":null,""When"":""""}]",null,
aa99fea3-3573-4aa6-a383-e5337b7f6609,https://www.google.com/maps/place/Boh+Arquitectos/data=!4m7!3m6!1s0xd4229ad8cc72e29:0x7a44314ff9e0b8df!8m2!3d40.4253693!4d-3.6823504!16s%2Fg%2F11s1px61_4!19sChIJKS7HjK0pQg0R37jg-U8xRHo?authuser=0&hl=en&rclk=1,Boh Arquitectos,Architecture firm,"Calle de Goya, 47, Salamanca, 28001 Madrid","{""Friday"":[""9 am–2 pm""],""Monday"":[""9 am–6:30 pm""],""Saturday"":[""Closed""],""Sunday"":[""Closed""],""Thursday"":[""9 am–6:30 pm""],""Tuesday"":[""9 am–6:30 pm""],""Wednesday"":[""9 am–6:30 pm""]}",{},http://www.boharquitectos.es/,911 17 70 55,C8G9+43 Madrid,63,5.000000,"{""1"":0,""2"":0,""3"":0,""4"":0,""5"":63}",40.425369,-3.682350,8810220990607964383,,,,https://lh3.googleusercontent.com/p/AF1QipNn0Un8syRCkKaAL_eyajhF4gXOtWBnbqq-KZto=w408-h272-k-no,Europe/Madrid,,0xd4229ad8cc72e29:0x7a44314ff9e0b8df,"[{""title"":""All"",""image"":""https://lh3.googleusercontent.com/p/AF1QipNn0Un8syRCkKaAL_eyajhF4gXOtWBnbqq-KZto=w447-h298-k-no""},{""title"":""Inside"",""image"":""https://lh3.googleusercontent.com/p/AF1QipMODzjfq1sp97Wjn-e6MSDLn2HvOV88eRR52Nle=w446-h298-k-no""},{""title"":""By owner"",""image"":""https://lh3.googleusercontent.com/p/AF1QipM6v61Q89Qba7zG_vpm4xk7eislxZ3XUl5BfV0j=w447-h298-k-no""},{""title"":""Street View \u0026 360°"",""image"":""https://streetviewpixels-pa.googleapis.com/v1/thumbnail?panoid=oQL6_94WpJ1ASx9xF1bsSw\u0026cb_client=maps_sv.tactile.gps\u0026w=224\u0026h=298\u0026yaw=359.97958\u0026pitch=0\u0026thumbfov=100""}]",null,null,"{""link"":"""",""source"":""""}","{""id"":""117596278465058870496"",""name"":""Boh Arquitectos (Owner)"",""link"":""https://www.google.com/maps/contrib/117596278465058870496""}","{""borough"":""Salamanca"",""street"":""Calle de Goya, 47"",""city"":""Madrid"",""postal_code"":""28001"",""state"":""Madrid"",""country"":""ES""}",null,"[{""Name"":""Lucia Fernandez"",""ProfilePicture"":""https://lh3.googleusercontent.com/a/ACg8ocJs9cPIY7YHr5HzGwvjuOwNK0Su_O1FAb5p874I_mDPTq4QyQ=s120-c-rp-mo-br100"",""Rating"":5,""Description"":""Reformamos nuestro piso con BOH hace un año y no podemos estar mas contentos. Fue una reforma integral en la que dejamos el piso diáfano y lo redistribuimos totalmente, no tuvimos ningún problema. El arquitecto, Jesús  es un profesional y siguiendo sus consejos los pocos problemas que surgieron se solucionaron para mejor. Ciro, el jefe de obra y su equipo no pueden trabajar mejor de lo que ya lo hacen, puntuales, serviciales y amables. Presupuesto ajustado, a pesar de los \"" y ya que estamos\"" y cumplen los plazos. Si algún día volvemos a hacer reforma integral no dudaríamos, en absoluto, en volver a trabajar con ellos.\nMuchas gracias por todo."",""Images"":null,""When"":""""},{""Name"":""Alberto Gallardo"",""ProfilePicture"":""https://lh3.googleusercontent.com/a/ACg8ocJ-8rSK3eHV91MkWUCKetoeOLav-J5kMFe3bGL4EOxu0GJKRTZh=s120-c-rp-mo-br100"",""Rating"":5,""Description"":""Encargamos a Boh la reforma integral de nuestro nuevo piso y el resultado ha sido espectacular, desde el proyecto hasta el proceso de reforma y por supuesto el resultado final.\n\nEstuvieron atentos a cualquier duda o necesidad que tuvimos y dieron respuesta a todos los desafíos que encontramos durante la obra.\n\nEl equipo es fantástico con mención especial a Kevin, que nos acompaño durante todo este viaje.\n\nCumplieron con el presupuesto y los tiempos que nos dijeron y han resuelto todos los pequeños detalles tras la entrega.\n\n¡Muchísimas gracias chicos!"",""Images"":null,""When"":""""},{""Name"":""Guillermo Canals"",""ProfilePicture"":""https://lh3.googleusercontent.com/a/ACg8ocLJ-FvuAu4Afi_FgCP8xRpOY_HLfHiRoADKMfkreMLnxVa2fw=s120-c-rp-mo-br100"",""Rating"":5,""Description"":""Muy contentos con la reforma de nuestra casa. Kevin y su equipo de Boh han estado geniales - siempre dispuestos a escuchar nuestras ideas y dando buenos consejos cuando teníamos dudas. Se nota que saben lo que hacen y te acompañan en todo el proceso. Han respetado los tiempos y el resultado final nos encanta. Lo que más hemos valorado es que siempre han estado abiertos a nuestras sugerencias, buscando la mejor solución para cada detalle. ¡Gracias por ayudarnos a crear nuestro hogar! 🏠"",""Images"":null,""When"":""""},{""Name"":""Xabier Montilla"",""ProfilePicture"":""https://lh3.googleusercontent.com/a-/ALV-UjX9wYOvpAJ1axiqR4nmW0bAAn-4v3nNJE_Jn6Fiid-Ko8obqx4=s120-c-rp-mo-br100"",""Rating"":5,""Description"":""Tuve una gran experiencia trabajando con Boh Arquitectos en mi reforma. Quiero destacar especialmente al Kevin, quien llevó mi proyecto de principio a fin, siempre con total dedicación y disponibilidad. Me resolvió muchísimas dudas con paciencia y propuestas bien pensadas, lo cual agradecí mucho.\n\nAlgo que marcó la diferencia fue que me acompañaron a escoger todos los materiales. Esto, que puede ser una tarea pesada, se volvió mucho más sencillo y llevadero gracias a su ayuda. Además, conocí a todo el equipo durante el proceso y me impresionó el nivel de compromiso y profesionalidad que tienen.\n\nEl resultado final cumplió con lo que buscaba y con los plazos establecidos. Si estás pensando en reformar o construir, recomiendo sin duda a Boh Arquitectos."",""Images"":null,""When"":""""},{""Name"":""Ignacio López Moreno"",""ProfilePicture"":""https://lh3.googleusercontent.com/a/ACg8ocLKSbeWEg6IH_DsYYBBX-T-27ev8pHz_9qpMJC9dDunXf-OJA=s120-c-rp-mo-ba2-br100"",""Rating"":5,""Description"":""Encantados con todo el trabajo del Kevin y el resto del equipo BoH en la reforma integral de nuestra casa. Nos sentimos muy acompañados y bien asesorados desde la fase de diseño del proyecto, toda la ejecución y hasta todos los remates tras la obra. Sin duda me volvería a poner en sus manos."",""Images"":null,""When"":""""},{""Name"":""Farmacia Hermanos Bou 57"",""ProfilePicture"":""https://lh3.googleusercontent.com/a/ACg8ocKrmpNpxU7lGvO0CKExEzykc_peeB4esXsKcLF4TKvQ7HHh=s120-c-rp-mo-br100"",""Rating"":5,""Description"":""Personal cualificado, muy competente y pendiente en todo momento. Sin duda volvería a contar con ellos. Gracias Kevin y equipo!"",""Images"":null,""When"":""""},{""Name"":""Carmen Ordoño"",""ProfilePicture"":""https://lh3.googleusercontent.com/a/ACg8ocL_2wUGKFIzHxehOlPckgofGZf_qOhseA5PqXbHvnTus1dntA=s120-c-rp-mo-br100"",""Rating"":5,""Description"":""Hemos realizado la reforma integral de nuestra casa y estamos encantados. Kevin, Alberto y todo el equipo son grandes profesionales, siempre dispuestos a aportar ideas y resolver todas nuestras dudas.\nLa ejecución de la obra ha sido impecable y los materiales de gran calidad. Repetiría con ellos sin dudarlo."",""Images"":null,""When"":""""},{""Name"":""Sergio Torres"",""ProfilePicture"":""https://lh3.googleusercontent.com/a-/ALV-UjXEEhqhvGwmVDMIF1OvzOIFUzKgkzRY__26AvliR7tQvpTyCNm1fQ=s120-c-rp-mo-ba4-br100"",""Rating"":5,""Description"":""Recomendamos Boh Arquitectos para realizar la reforma de tu casa. Encantados con el trabajo realizado con el equipo de Alberto, que fue el responsable que nos dirigió la reforma y con un gran acierto. Hicimos una reforma integral de nuestro piso, tanto suelo, como paredes (quitar gotelé), derribar muros, baños, calefacción, etc. Realizamos la reforma de todo el piso en menos de tres meses y muy contentos con el resultado. En cuanto al precio, también muy contentos porque nos rebajaron en varios puntos del presupuesto además de ser una de las opciones más económicas que miramos. En definitiva, recomendamos esta empresa para realizar la reforma, son muy serios y siempre responden. Además, tienen su propio equipo de operarios y son bastante buenos todos. Saludos"",""Images"":null,""When"":""""}]",null,
aa99fea3-3573-4aa6-a383-e5337b7f6609,https://www.google.com/maps/place/Ghg+Arquitectos/data=!4m7!3m6!1s0xd422614c34e3a6f:0x89dc1caefed81f78!8m2!3d40.3994513!4d-3.6878269!16s%2Fg%2F1td1l92x!19sChIJbzpOwxQmQg0ReB_Y_q4c3Ik?authuser=0&hl=en&rclk=1,Ghg Arquitectos,Architect,"C. de Ramírez de Prado, 7, Arganzuela, 28045 Madrid",{},{},http://www.ghgarquitectos.com/,912 21 02 61,,2,4.500000,"{""1"":0,""2"":0,""3"":0,""4"":1,""5"":1}",40.399451,-3.687827,9933846415997935480,,,,https://streetviewpixels-pa.googleapis.com/v1/thumbnail?panoid=TtM-jjG-Z79WBznjsKHQuw&cb_client=search.gws-prod.gps&w=408&h=240&yaw=10.814712&pitch=0&thumbfov=100,Europe/Madrid,,0xd422614c34e3a6f:0x89dc1caefed81f78,"[{""title"":""All"",""image"":""https://streetviewpixels-pa.googleapis.com/v1/thumbnail?panoid=TtM-jjG-Z79WBznjsKHQuw\u0026cb_client=maps_sv.tactile.gps\u0026w=224\u0026h=298\u0026yaw=10.814712\u0026pitch=0\u0026thumbfov=100""},{""title"":""Street View \u0026 360°"",""image"":""https://streetviewpixels-pa.googleapis.com/v1/thumbnail?panoid=TtM-jjG-Z79WBznjsKHQuw\u0026cb_client=maps_sv.tactile.gps\u0026w=224\u0026h=298\u0026yaw=10.814712\u0026pitch=0\u0026thumbfov=100""}]",null,null,"{""link"":"""",""source"":""""}","{""id"":"""",""name"":""Ghg Arquitectos (Owner)"",""link"":""""}","{""borough"":"""",""street"":"""",""city"":"""",""postal_code"":"""",""state"":"""",""country"":""""}",null,"[{""Name"":""Aquilino Hernandez"",""ProfilePicture"":""https://lh3.googleusercontent.com/a/ACg8ocLboirf306GCdzs_SOX7JMhbrWv2AxDeeYXto2do6R7M2tpLg=s120-c-rp-mo-ba4-br100"",""Rating"":5,""Description"":"""",""Images"":null,""When"":""""},{""Name"":""Adam Nboufarrouj"",""ProfilePicture"":""https://lh3.googleusercontent.com/a-/ALV-UjWdPk403KW9limMrHmsYLtGw3xlkm3QMf1C9Oza8oajSynlD7najA=s120-c-rp-mo-br100"",""Rating"":4,""Description"":"""",""Images"":null,""When"":""""}]",null,
